{
  "contract_name": "SIMS_SBM_DOCTOR_BATCH_ACCEPTED_V1",
  "contract_version": "1.0",
  "batch_request_id": "SBM-BATCH-20260804-001",
  "queue_record_id": "BQ-A7F4D132081C",
  "status": "ACCEPTED",
  "accepted_at": "2026-08-04T00:12:44.224388+00:00",
  "item_count": 2,
  "duplicate_submission": false
}
